{
  "$schema": "https://json-schema.org/draft/2020-12/schema",
  "$id": "https://uniclaw.dev/schemas/workspace/runtime-run-response/v1",
  "title": "UniClaw RuntimeRunResponse",
  "type": "object",
  "additionalProperties": false,
  "properties": {
    "schemaVersion": {"const": "uniclaw.workspace.runtime-run-response.v1"},
    "contractVersion": {"const": "uniclaw.workspace.contract.v1"},
    "ok": {"type": "boolean"},
    "idempotent": {"type": "boolean"},
    "run": {"$ref": "https://uniclaw.dev/schemas/workspace/runtime-run-projection/v1"},
    "error": {"$ref": "#/$defs/businessError"},
    "revision": {"oneOf": [{"type": "integer", "minimum": 0}, {"type": "string", "minLength": 1}]},
    "observedAt": {"type": "string", "format": "date-time"},
    "consistency": {"enum": ["current", "stale", "partial"]}
  },
  "required": ["schemaVersion", "contractVersion", "ok"],
  "allOf": [
    {"if": {"properties": {"ok": {"const": true}}}, "then": {"required": ["run"], "not": {"required": ["error"]}}, "else": {"required": ["error"], "not": {"required": ["run"]}}}
  ],
  "$defs": {
    "businessError": {
      "type": "object", "additionalProperties": false,
      "properties": {
        "code": {"type": "string", "minLength": 1},
        "message": {"type": "string", "minLength": 1},
        "retryable": {"type": "boolean"},
        "details": {"type": "object", "additionalProperties": true}
      },
      "required": ["code", "message", "retryable", "details"]
    }
  }
}
